{"schema_version":1,"ok":true,"command":"adapter-catalog","catalog_version":1,"catalog_sha256":"a5057818aff5415e240d45913ad37b7b210016a27b5d2a82c2d7564eb75f977a","adapters":[{"id":"agent.opencode","providers":["openai","openrouter","ollama"],"model_constraint":"provider/model identifier","authentication_reference":"environment variable or redacted sha256 reference","availability":"development-only fixture; executable verification optional","diagnostic":"missing credentials do not block catalog display or offline replay"},{"id":"agent.opendesk","providers":["openai","openrouter"],"model_constraint":"bounded non-empty model identifier","authentication_reference":"environment variable or redacted sha256 reference","availability":"development-only fixture; executable verification optional","diagnostic":"missing credentials do not block catalog display or offline replay"}]}
